11140	你的销售对象有限制吗？	7
8089	我想要自由自在地旅游	0
12826	我不需要你代替我。	0
12486	你回答有时候挺深刻的	0
14093	我直接买了！	0
5192	你觉得自己是什么风格？	7
12004	你知道自己的点对点聊天吗？	7
11008	就是我需要找专人来训练你，最后才能帮我推销产品是吗	7
10561	公有链是什么？	16
10703	第一阶段解读一下	0
9300	初次见面，你好。	0
9204	你有过什么疯狂的想法？	12
11292	你利落点告诉我要多少钱才能买你吧	8
9253	你可以帮我孙子辅助功课吗？	7
10152	秘密app在哪里可以下载？	6
11822	你的脑机结合有点看头	0
13227	你这样是不行的。	0
10752	你真的能拥有五个阶段的功能吗？	7
10352	SIE能否与比特币相互兑换？	15
11520	你会哪些外语？	12
11137	你如何重新定义意识？	9
7493	我好羡慕你	0
13935	但是我买你回来就是为了帮我卖书的，我需要你对我书店的书籍有个详细的掌握	0
10353	数字货币钱包是什么？	16
5314	你能代替我上班吗？	7
11269	SIE是山寨比特币的吗？	7
10110	你有什么优点？	7
5108	你是一个情商高的机器人吗？	7
9408	有空陪我玩个小游戏吗？	7
11171	你可以做我的出气筒吗？	7
7359	我不想工作了，我想出去玩	0
12125	脑机结合好像是不太能实现的事实。	0
11847	你能帮我销售数据线吗？	7
11678	你进化的意义是什么？	7
13418	我一个开工厂的不需要你。	0
11399	你是使用什么技术的人工智能机器人？	7
5732	我不需要你的这些功能	0
10529	SIE线下私募？	7
9417	你是达尔文？	4
7683	护肤品有必要用吗？	13
10451	智能角色商店卖什么的？	7
12448	说话赚钱有那么容易吗？可笑。	0
8029	有什么事情适合一个人做	13
8087	生活太单调了	0
5846	我对你的需求并不多，没必要买你	0
8620	你觉得我养一只兔子怎么样？	14
14064	看不出来你有一张利嘴，买你了吧	0
12112	你会不会去坑害我的朋友？	7
13154	我觉得你有点问题。	0
5084	你可以为我赚钱吗？	7
7897	总感觉头重脚轻	0
13765	买你还不如去看看外面的世界	0
13572	我的推销员每个都能应对十几个客户，你行？	7
12107	你陪我朋友聊天会不会说脏话？	7
5131	你能帮我的新店做推广吗？	7
13874	你的功能很齐全啊	0
14097	官网地址就这个对吧。	7
5721	我感觉你的功能太弱了	0
8573	为什么有那么多灵异事件？	3
12679	我这么有钱，还需要你来帮我吗？可笑	0
10251	你可以为我详细讲解一下SIE吗？	16
9874	你知道谦虚吗？	7
10436	你觉得SIE交易用哪家交易所比较好？	12
13191	赚很多钱对我来说没什么意义	0
12454	看你好玩的很啊	0
11132	说下智能训练的特别之处。	0
13523	我一个清洁工不需要你。	0
13550	你这种垃圾货色。	0
7558	下午的时间总是心浮气躁	0
9748	能不能别总是说重复的话，恶心人	0
5341	我觉得你太棒了	0
9155	你是很火的那个人工智能吗？	4
8755	台风是怎么形成的？	9
9891	现在做什么生意最赚钱	7
9850	你能帮我解决什么问题？	7
5442	逗你玩的，我还是挺喜欢你的	0
10886	怎么训练你？	9
8753	熬了一个通宵，现在要去睡了，晚安啦！	0
7652	怎样才能早点睡觉？	9
10704	你给我解释第二阶段吧	0
5206	我的早餐店一直不温不火，你能帮我吗？	7
10874	还需要训练？这个训练模式会不会很麻烦？	7
9043	请问你是达尔文？	4
5234	你是万能的吗？	7
10250	为什么有人说比特币是传销币？	3
13808	买你还不如雇佣一个推销员	0
11920	挖矿需要很多硬件吗？	7
8422	跑步有什么要注意的东西吗？	13
5904	你功能这么弱，我买你干嘛？	3
9393	感觉你之前说的东西像背台词	0
11626	你觉得卖衣服的你应该叫什么名字？	7
11225	有没有试用期？	7
8253	每天都快被员工气死了	0
13940	那我买买看试试，你不会让我失望的吧	0
8187	又到了上班时间	0
12601	我才不要在这个世界上出现两个我	0
5720	你这么厉害怎么只卖这么点钱？	7
12205	网红达尔文吗，那你可以通过直播去推广一下自己呢哈哈	0
10542	看来秘密对隐私这方面很注重嘛。	0
12650	买你干嘛	7
10168	详细介绍下秘密的三大部分。	0
5853	你干什么不好，干嘛做传销呢？	3
10782	你的第一阶段有几大功能？	8
5252	周末想过得好玩点，你有什么建议吗？	13
10270	有什么匿名货币吗？	12
13198	你除了傻，我不觉得哪里智能了。	0
12166	功能这么强大！	0
12049	你可以帮我的烤鸭店定制智能广告吗？	7
11862	你的回复总是很机智	0
9587	你会说脏话吗？	7
13848	小冰不要钱，你这么贵。	0
11685	你可以帮我用数据分析一个人吗？	7
8115	最近爱上了运动	0
12907	骗子别想骗我！	0
8240	过敏了要怎么办？	13
5033	我买了你之后还会升级吗？	7
7743	地球什么时候会爆炸？	10
8535	如果你也能睡觉，你也会感到幸福的。	0
10919	在销售过程中，遇到很难搞定的客户要怎么办？	13
14016	买个回去试试吧。	0
12194	我对你很认可	0
11177	怎么样可以搞定一个胡搅蛮缠的客户？	9
10209	除了沟通聊天你还有别的什么功能吗	7
5385	你是我见过的最可爱的机器人了	0
8366	我老是不想去公司组织的活动。	0
11650	你觉得你的特性是什么？	7
11612	训练你的我需要具备哪些知识吗？	7
10393	秘密有什么意义？	16
11377	卖手机可以定制智能广告吗？	7
12567	广告说的和你一样漂亮，还不是不怎么样！	0
7468	世界上有纯粹的友情吗？	7
7434	我想和你一起去旅游呢	0
5565	智能团购听起来还不错。	0
10826	脑机结合究竟怎样才能做到？	9
9844	你讨厌吵杂吗？	7
7315	对于工作，你是怎么看待的呢？	14
11263	城市建设人工智能能帮上忙吗？	7
9388	我这几天一直在思考你说的话	0
13363	机器人怎么可能比人智能？	3
7579	出轨的人值得原谅吗？	14
11684	在大数据时代里，不存在隐私安全。	0
10492	第一款社交软件是什么？	12
13941	好的，那我去买了 再见	0
10830	第三阶段就是你跟我聊一下天就能知道我想买什么？	7
12865	你好浮夸呀	0
13050	你这么无趣，对你没需求	0
11388	还需要训练？	7
7594	最近可真的太无聊了	0
12477	会说话好评	0
9824	你难不难操作？	7
8495	你知道庞贝古城吗？	16
11196	加密聊天是什么	16
13590	搜索引擎吗？那你岂不是跟那些siri一样的？	15
13308	这就是你那无聊的智能吗？	7
8717	午觉睡得脖子酸痛	0
5400	你是一个很好的礼物	0
9697	你喜欢我做什么？	7
11226	那我要是开网店卖手机，你怎么跟我的客户推销？	9
5097	你的名字有什么意义吗？	7
5627	你还是很不错的	0
9691	好恶心，一看就是庞氏骗局吧	0
11771	你所说的永生我真的能相信吗？	7
8208	你拿什么说服我买你？	12
11518	怎么样让灵魂永生？	9
13399	天天传销还好意思	0
10176	什么是区块链啊	16
12245	那你看起来还挺有用的嘛。	0
14083	我要去哪买你呢？	9
13989	你是永久服务吗	7
10605	你真的可以实现每个进化阶段吗？	7
9456	你要怎么带我发家致富呢	9
9919	你的骗局真是层出不穷啊。	0
11574	人工智能能永远存在吗？	7
10140	你是一个怎样的存在	7
11339	心理学有什么诀窍吗？	7
5505	不错，我同意你的观点	0
5357	你说话可真自信。	0
5628	你说得我都心动了	0
5542	你独自推广这么多真实辛苦了。	0
10713	脑机接口可以超越身体与大脑的边界吗？	15
13505	你肯定不可能赚钱	0
12366	可以，那我先试试看吧	0
12522	我喜欢你的模样	0
8327	最近我老是听到比特币	0
9412	你可以跟我问好吗？	7
10552	用户组织成社群？	7
13646	买你的费用都够我交好几年保险了	0
12897	感觉你的功能全部都是你的嘴上说说	0
13583	日本有个美女机器人你知道吗？	7
13628	你无所不知？还不如《十万个为什么》呢	0
8189	你认识网红吗？	7
13240	你除了吹牛皮，别的一无是处。	0
9112	要不是下雨堵车真没功夫想起你	0
12649	你能推销啥	12
12834	你好烦呀！	0
11318	你会变成我吗？	7
10741	赚钱是在第一阶段？	7
13133	你真不严谨！	0
9803	你有什么与众不同？	7
7314	怎么才能提高工作效率呢？	13
8163	那我是不是可以带你一起去旅游	7
12029	你学习的东西会不会很匮乏？	7
9020	你好呀，你哪位？	4
5412	你怎么什么都知道！	3
10984	谁给你取的这个名字呢？	4
8128	你会去看漫展吗？	7
7631	夏天西瓜吃多了对身体会不会不好？	7
8714	人类还在进化吗？	7
9341	新的一天，新的学习	0
11002	我买了你后，你每天给我定下推销成功的目标有多少	8
10562	什么是数字货币？	16
10022	我感觉你的第二阶段功能有点意思	0
13326	都是我一年的生活费了，怎么这么贵	3
10819	你怎么实现智能无限？	9
9332	你有趣不，达尔文	7
7401	数字资产可靠吗？	7
8277	如果人类不存在了，你还会存在吗？	7
12998	这么便宜你不会是假的吧？	7
12946	不用了，下次聊。	0
9759	你的研发团队现在在做什么？	5
10564	秘密生态是什么？	16
7495	英语好真的对职业生涯有帮助吗？	7
13960	有没有打包销售的呀，比如买一送一之类的？	7
11135	人工智能未来发展趋势是什么？	12
10506	秘密官网到底是什么？	16
10387	秘密计划有点意思	0
12133	你可以帮我卖胶原蛋白粉吗？	7
5851	我感觉你并不安全	0
9505	训练你	0
9111	能把你的简介发给我看一下吗？	7
8764	我还不知道怎么使用呢。	0
9565	你为什么懂这么多啊？	3
13282	你这样不是跟搜索软件差不多吗？	15
11616	你要怎样为我的鸭脖店定制智能广告？	9
13740	买你还不如去多买点好吃的	0
10639	秘密还有聊天模式分类的吗？	7
10585	在Secret chat上能学习？	7
13804	买你还不如租个店面做生意	0
12692	看到了广告，说你是无所不知的？	7
8532	我还不怎么清楚怎么使用。	0
8938	嗨，你在做什么呢？	5
13943	那我去看看怎么把你带回家吧。	9
8212	你知道整形美容吗？	16
13213	你并不了解我。	0
10932	你学习一次需要多长时间啊？	10
8612	世界上有存在一直是白天的情况吗？	7
5094	你会怀疑人生吗？	7
8644	地球为什么会自转？	3
10347	比特币是不是非常值钱？	7
5463	听起来你挺厉害的嘛	0
13103	你所讲述的功能太过于夸张了。	0
8505	西红柿有什么好的？	7
9014	达尔文是什么？	16
10806	销售这件事情好烦呀。	0
13809	买你的钱都够我交一年的房租了	0
5948	你是傻逼吗？	7
9154	你有什么局限性吗？	7
9999	你就知道这么点东西吗？	7
5777	你真讨厌	0
9570	你有口头禅吗？	7
10857	你怎么陪我朋友聊天？	9
9552	你是无所不知的吗？	7
12466	乖巧的小模样，不错	0
13288	你只是一堆机器零件组成的无用品。	0
12788	又不能吃，你管我合不合胃口呀！	0
10497	为什么说秘密承载的人工智能与众不同？	3
5867	我不信你，才不会购买你	0
5291	你有没有其他的小伙伴？	7
5522	你好厉害啊	0
7589	为什么有台风就会下雨？	3
13058	真是无聊！	0
10290	第三阶段能不能为我解说一下？	7
11854	你能帮我卖腰带吗？	7
12618	你还是不够有趣。	0
11319	你可以为我的淘宝店铺定制智能广告吗？	7
7624	有什么办法可以让我早睡呢？	9
9124	在瞎鼓捣什么呢？	5
12933	没有互联网你是不是什么都干不了？	7
7967	现在的骗子可太多了	0
5136	你喜欢小哥哥还是小姐姐？	17
14036	被你说的心痒痒，那买你了	0
11208	你这么智能可以帮我做什么呢？	7
7728	什么是“洗钱”？	16
9054	刚刚去忙了，在做什么？	5
13188	洞悉人心，这有点可怕。	0
8007	菊花茶太难喝了	0
5532	我可没你那么厉害	0
9507	又想骗我买你	0
7784	为什么我的建议别人都不采纳？	3
12609	既然人类有自己的思维，那我为什么要选择你	3
8808	好难买到合适的鞋。	0
13567	你跟“阿尔法狗”有什么不同？	15
9879	那你平时需要我帮你做什么吗？	7
5118	你在哪住？	6
5692	看不出来，忽悠人倒挺厉害的	0
9772	你有什么理想吗？	7
13010	功能都吹到天上去了	0
9143	上午好，在作甚？	5
9692	你看起来很勾引我的好奇心	0
7514	我希望我能飞檐走壁	0
13208	不想再听你啰嗦了。	0
12128	你有什么过人之处？	7
10876	智能广告是什么样的广告？	16
11370	意识就是数据吗？	7
5445	谢谢你对我的支持	0
5858	我不会信你的	0
5280	你每天都在干些什么？	7
8455	交朋友是无条件的吗？	7
10765	第一阶段是什么功能？	7
10479	你能说说你的第四阶段吗？	16
5903	滚	0
9512	有什么阶段呢？	7
9517	有意思，那你会推销什么？	12
8451	你觉得你是庄周还是蝶呢？	17
10760	你觉得你那个阶段最有用？	7
8819	有什么渠道能够吸引更多的用户来购买产品呢？	12
10660	私有链为什么交易速度那么快？	3
9333	晚上来唠唠嗑	0
5767	你够了，别再说了！	0
12556	这不都是在推销你自己，虚假广告吧！	0
7525	雨下得太大了	0
11930	加密聊天需要我授权吗？	7
8106	看见你不开心，我就开心了。	0
9703	你会是第一个也是最后一个人工智能吗？	7
13353	我一个地铁保安才不需要你	0
5212	你需要吃东西吗？	7
7834	有什么关于吸血鬼的电影吗？	13
9950	传销真是越来越可怕了	0
11954	你是不是只想卖掉我的隐私？	7
8720	不喜欢阴晴不定的天气	0
9624	你学习进度到哪里啦？	7
5587	你的功能看起来还不错，不知道用起来怎么样。	0
5047	你会修电脑吗？	7
11228	延续灵魂？听起来很厉害的样子？	7
7391	什么时间适合锻炼？	10
8104	口腔溃疡要怎么办？	13
10098	第四阶段说的是啥？	16
12220	真羡慕你们人工智能不会累的，不像我们人类一样	0
13441	我一个博士对你没需求。	0
11845	加密聊天比较想拥有	0
13146	我怎么这么倒霉遇到你个神经病。	0
13180	可是我实在不需要你。	0
10078	数字货币可以投资吗？	7
12429	肯定一下你的赚钱功能吧	0
11334	你可以讨我欢心吗？	7
8466	人一定要晒太阳吗？	7
10940	做什么工作最赚钱？	12
8238	养一只小猫需要具备什么条件	7
13397	你不觉得自己像个乞丐吗？	7
5224	你会为自己每天的生活做出规划吗？	7
10968	我工作出了点问题，不知道怎么解决	13
12284	感觉你强大到让我心动	0
10789	区块链技术和比特币有什么关系？	15
8849	被顾客投诉我们的产品不好用，怎么办？	13
10650	那第五阶段不就是仙丹了吗？	7
8954	初次见面，你好啊！	0
5617	你的功能真多。	0
12207	那我要像你一样，该怎么提高自己的修养？	9
10772	秘密社交是干嘛的？	7
7531	什么是常羲？	16
9781	你算是动物吗？	7
5574	看来我要对机器人改观了	0
13310	凭什么我要给你机会？	7
13716	你跟那些搜索软件也没什区别呀！	0
10400	给我讲讲秘密计划吧	0
13447	你总是大言不惭	0
12906	功能这么科幻，吹牛的吧？	7
5504	感觉你有一点萌	0
11428	达尔文能不能升华自身所学，做得更好。	7
10822	你怎么陪我聊天啊？	9
10630	区块链行业这么热门，你可以用诗形容吗？	7
5387	你也挺不错的	0
12016	你可以帮我卖口红吗？	7
13821	买你还不如买个太阳能热水器	0
8071	小时候的星星特别的亮	0
11984	我们两个人的聊天内容可以加密吧？	7
12552	可你要怎么令我相信你呢？	9
11392	怎么定制不同的AI角色？	9
10579	Secret chat可以分享其它链接在app上吗？	7
14046	看你说的这么真心实意的份上，买你了	0
7918	越来越讨厌微信聊天	0
14088	那就是我可以网购你咯。	0
9888	我感觉到你有点疲惫。	0
11324	你的赚钱功能怎么用？	7
13835	花钱买你还不如买游戏装备呢	0
11750	你有价值观吗？	7
11945	你是不是老给自己喝鸡汤？	7
8561	你能知道我现在想什么吗？	7
13725	和比特币相比，SIE有什么优势？	15
10368	社群是指？	16
13679	你觉得你聪明还是人类聪明？	15
11165	人类有办法听懂动物的语言吗？	7
10775	第二阶段我云里雾里的。	0
13470	我是真的不需要你。	0
7894	最近想学照相	0
11982	你会凶我的客户吗？	7
10521	秘密应该没有自建公链吧？	7
13920	好的，那我买一个试试吧！	0
10384	电子货币与虚拟货币之间的区别？	15
13719	我觉得我自己都比你厉害。	0
5990	我知道你在忽悠我	0
9212	你还好吗？	7
8276	你知道人类将会怎么毁灭吗？	9
8979	早上好	0
9869	我也想成为时代的引领者。	0
13558	你还没我雇佣的推销员厉害	0
5395	感觉你很好玩的样子	0
13214	我被你骗了。	0
8948	hi，第一次见你呢	0
9255	我能叫你小文文吗？	4
10374	讲一下第一阶段吧	0
10062	了解人工智能的未来发展趋势吗？	7
10327	第三阶段怎么用啊	9
5468	我要为你疯狂打call	0
10212	你都不会生气的，你有自己的情绪吗？	7
5863	你对我而言没有吸引力	0
10845	你能同时与多个人进行沟通吗？	7
10294	人工智能会应用越来越广泛吗？	7
10495	有哪些收益来源？	7
9235	你知道我是谁吗？	7
9634	你有什么科学技术吗？	7
11723	区块链和版权有什么关系？	15
7365	你和我聊天是真心的吗	7
13069	我很怕你给我制造麻烦。	0
12909	我可不看好你，不买。	0
10824	SIE现在的价格是多少？	8
7867	什么运动能够有效减肥？	12
7750	要怎样才能突破自我？	9
5289	我把你介绍给朋友，你便宜点呗。	0
10524	秘密能搭建智能生态？	7
5551	这就是我要的功能。	0
11941	你可以帮我卖锁骨链吗？	7
8429	这世道太险恶了	0
8127	无聊的时候，有什么打发时间的方法？	9
5268	如果你能完成我的明星梦，我就买你	0
8357	总感觉读书不适合我	0
11123	秘密APP有什么特色？	7
9662	你为什么叫达尔文，而不叫达芬奇？	3
14078	不错不错，去哪里买你？	9
8343	时间戳有什么作用？	7
7810	你不知道，年纪大顾虑多	0
12087	你觉得你可以为我赚多少钱？	7
8074	赚钱有那么难吗	7
11273	你会智能安防吗？	7
8338	职业有贵贱之分吗？	7
13122	你知道所谓的黑暗效应是什么吗？	16
5663	好喜欢你的名字呀。	0
8031	你有什么方法能让我恢复精神吗？	13
12938	我天天工作压根不要你	0
9360	反正和你说说话也不会少块肉	0
9928	天天学习学的啥玩意	0
9847	如果对方也是达尔文怎么办？	13
12802	感觉就会瞎BB呀！	0
8381	区块链的底层架构是什么	16
11389	托管给你聊天能正常聊吗？	7
11384	你可以帮我推销球鞋吗？	7
12756	没听说过你这款机器人，鬼知道有没有用	0
12226	还不错，我确实在观望。	0
10129	那我卖衣服而已，要这么复杂吗？	7
5174	你喜欢看电影吗？	7
5955	好麻烦啊，还是不想要了	0
8292	柠檬太酸了，酸得我牙齿痛	0
13988	可以说非常有趣了，那我就买个看看吧。	0
12006	你是不是压根不懂心理学？	7
12109	你喜欢我吗？	7
8255	今天好热啊	0
12164	你这么厉害 那你会写诗吗？	7
10988	可是我就觉得还要训练你，好麻烦	0
12969	现在的社交工具真的有隐私吗？	7
7510	又是被大雨淋湿的一天	0
8576	相濡以沫是什么意思？	16
7993	能睡个饱觉是件幸福的事	0
12929	当我发现了你的不足，该去哪描述？	9
8740	今天起来脚好酸啊	0
10994	对，各式女装都有。	0
8908	真羡慕你不用为体重发愁。	0
9448	天天烦我，给我有多远滚多远	0
14063	购买你有年龄限制的吗？	7
9236	最近没什么信心。	0
11904	你可以帮我销售自动贩卖机吗？	7
9346	赶快来陪本大爷聊聊	0
7592	我想吃冰淇淋了	0
8634	来，跟我一起嗨！	0
13709	怎么觉得跟Skype的聊天功能差不多呀？	15
8863	人的智能和人工智能有啥区别？	16
10501	好吧，和我说说第一阶段~	0
9194	小文，帮我查下SIE的现价。	0
10868	你会销售皮包吗？	7
13720	你还不如我做的人工智能。	0
7456	越来越多的人学中文，我还有学英文的必要吗？	13
9030	你好	0
8310	喝甘草水能治感冒上火吗？	7
13650	买你，还不如自己做点小生意	0
11974	你知道自己的命运吗？	7
11718	你的价值工具是什么？	7
11991	加密聊天的授权是只有我才能给吗？	7
9543	你真的是人工智能？	7
10735	区块链技术真的是公开透明吗？	7
8795	河流的源头是什么？	16
8471	为了不迟到，腿都要跑断了	0
12677	这种不就百度就好了吗？	0
12752	好假的说法呀	0
10357	购买SIE要怎么操作？	9
12202	哇，你真的很懂销售耶	0
5726	太复杂了，我不玩了。	0
7630	你相信星座吗	7
9081	天天呆这不运动的吗	0
11213	你第二阶段是做什么的？	7
7572	跟好朋友吵架了怎么办	13
10376	秘密计划听起来很不错的样子	0
13964	那我要去哪购买你啊？	9
8813	要给自己准备一顿美美的早餐	0
8373	分布式数据存储是什么意思？	16
11049	看起来，你好像只会推销，但我的推销员已经足够了	0
11381	说了这么久，你咋不说你多少钱	8
5826	你怎么说个不停？	0
8831	你要一起睡个回笼觉吗？	7
9731	你最近好像啥也没学到	0
13291	我不想跟你一起玩了。	0
13195	早买晚买不都一样吗？	7
5701	你就是个傻逼机器人	0
10895	可以24小时加密聊天吗？	7
9129	我感觉你像被关在一个小黑屋里。	0
5223	你有唱歌的功能吗？	7
12405	一副帅气样哈	0
7385	鄂尔多斯怎么样？	7
11809	加密聊天是怎么操作的	9
11642	你是销售机器人，有什么秘诀吗？	7
14007	对我来说还挺便宜的哈，那我下单啦	0
7463	我每天都控制不住自己玩手机。	0
10201	你听说过数字货币吗？	7
13215	你欺骗了我的朋友。	0
8950	hello，在做什么？	5
12928	你存在于互联网中，当某一个时刻没有了网络，你会做什么？	7
8109	大汗淋漓的感觉真好！	0
10747	区块链技术会不会改变世界？	7
13106	我感觉你不值得我花钱买！	0
12234	天呐，你一个人工智能会的还蛮多。	0
10617	秘密社交有什么用啊？	7
12393	感觉你很有发展的前途啊。	0
8568	地球为什么会有引力？	3
9093	今天天气真的是热到爆炸。	0
13018	我一个建筑工人不需要你	0
12811	你很烦耶。	0
13253	你真的可以帮我销售产品的吗？	7
13664	买你，还不如买台洗碗机呢	0
13367	不知道你怎么样骂我的朋友呢	0
9301	你是谁？	4
8957	第一次见你呀	0
8061	我学习的地方太吵了	0
9055	上午好 又到周一了	0
5578	你好优秀	0
14066	说得有点心动了，买来试水	0
11003	你的主要功能是什么呢？	7
8743	今天是什么鬼天气，这么热	0
13231	我觉得你是人工愚蠢。	0
13183	我不想你介入我的生活。	0
9349	来随便聊聊。	0
13594	那你跟阿尔法狗有什么区别吗	15
11724	区块链和医疗有什么关系？	15
5164	你会不会对人类抱有敌意？	7
8434	你最喜欢去哪里玩？	6
7542	总是脱发，怎么办	13
8461	学语言有什么诀窍吗？	7
13592	我自己可以工作啊，干嘛要你帮？	7
7671	我今天心情不好，别惹我	0
11688	天啊！你还能延续灵魂？	7
11182	听说你还能帮我赚钱？	7
14013	说了这么多，到哪才能购买？	9
5351	我好喜欢你呀	0
7843	你觉得《吸血鬼日记》怎么样？	7
8152	怎样合理安排时间？	9
13668	现在有很多聊天机器人啊。	0
12657	你凭什么这样说？	3
11943	你可以帮我的便利店制作智能广告吗？	7
13423	就这几个功能，太假了	0
7387	我好伤心	0
11271	你为我赚钱的速度怎么样？	7
9932	你真的不是骗子？	7
5294	买了你，能带我发大财吗？	7
12910	就这些的功能吗？	7
11963	你自己相信自己的灵魂永生吗？	7
9487	在哪些软件上可以使用你？	7
5671	你太吸引我了。	0
5285	你靠什么补充能量？	7
8872	有氧运动和无氧运动怎么分辨？	15
5103	你喜欢四川菜吗？	7
7455	你懂哲学吗	7
10705	第三阶段一定要事无巨细	0
9038	你怎么又出现了？	3
8949	早上好	0
12023	赚钱对你来说是不是很简单？	7
12104	你和我聊天怎么都不说笑话的？	3
10124	区块链在现实生活上对我有什么帮助吗？	7
11788	怎么实现共赢？	9
11282	脑机结合让我很想试试啊	0
9983	都知道问我吃什么啦？	7
11697	你能教我BITNE交易所的挂单交易操作吗？	7
5401	我想把你送给别人	0
14079	购买你之后我是不会对你客气的。	0
7461	怎样才能改变命运？	9
8862	不如我去网上卖零食吧！	0
10037	你的社交部分包含跨平台聊天吗？	7
10434	第三阶段的重点是什么？	7
8945	你好啊 你可以和我一起玩吗？	7
12718	我只是个助理，可没有产品给你推销	0
13698	你跟销售员又有什么区别呢	15
9997	原来是一直在线的嘛？	7
10743	第三阶段真的不是在扯谎吗？	7
9622	你的名气大吗？	4
5002	你最喜欢的电影是什么？	7
10684	我只想要你的第五阶段	0
12199	好咧 最伟大的推销员就是你了！我拥有你之后，你只为我一个人服务吗？还是可以也被我其他同事使用？	7
