12715	因为我见过太多的这种小伎俩了。	0
10109	你作为一个推销员，你有什么样的职业水平啊？	7
7635	忘记了结婚纪念日，老婆生气了	0
11253	当前是讲究特色的，你都有些啥？	7
12035	你的训练方法是自成体系的吗？	7
12978	功能这么差劲，有什么用？	7
10253	秘密AI部分的神奇之处在于哪里？	7
9287	听说你打破了单边受益的生态？	0
13373	你不就是个科普软件吗？	7
11887	你能帮我销售墓地吗？	7
11447	可以只购买智能广告定制吗？	7
11307	我的聊天记录不会泄露出去吗？	7
9897	你觉得你颠覆了什么？	7
8911	太晚睡觉会怎么样？	7
13903	行吧， 我正好缺个机器人，买你了	0
13521	你不烦我我就谢天谢地了。	0
11477	我可以直接购买哪个阶段的你吗？	7
13593	娱乐行业那么赚钱，我要不去做这个？	7
10220	“秘密”生态是个什么？	16
5514	你说话还挺有意思。	0
9994	你怎么这么逗呢	0
5348	哈哈说到我心坎了	0
13520	有多远滚多远。	0
9533	说得这么玄乎，搞得跟传销一样	0
11277	共识机制？不太懂	16
7358	今天的工作太忙了	0
10247	共享单车有使用区块链技术吗？	7
5833	我现在就挺好，不需要你	0
7516	如何找到自己真正想做的事情？	9
5643	买吧，我还挺喜欢你的。	0
5898	买你是在浪费钱	0
11748	不太懂你的托管模式。	0
9976	你不是来骗钱的吧？	7
10433	SIE的作用是什么？	7
7941	年纪轻轻就身体不好可怎么办？	13
11803	你会爱自己的主人吗？	7
7902	我感觉我心太累了	0
12985	我一个地铁工作人员不需要你	0
7779	为什么每个人都要去赚钱呢？	3
8996	你是个什么东西？	7
11291	说说你怎么为我赚钱？	9
11122	人工智能和区块链结合？	7
5070	这世界上有你做不到的事吗？	7
8901	我对小动物们不是很了解。	0
5860	我只想买个聊天机器人，你太贵了	0
9520	具体介绍下自己吧。	0
11913	给我说说区块链中的算法。	0
7620	我不想再下雨啦！	0
9318	再次见面，你觉得我怎么样？	7
8696	最古老的树是什么树？	7
5193	你有喜欢的画家吗？	7
8415	有很多事情你都不能经历，太可惜了	0
12571	这都能赚钱，我是不信。	0
13340	我一个开小卖部的不需要你	0
5994	你大话说的脸不红心不跳	0
12654	只需要设定语言风格还有属性这些就好了吗？有点让人不放心呢	7
12108	你能理解我现在不好的情绪吗？	7
11373	人工智能最近有做出什么突破吗？	7
7978	广告有什么好处	7
8811	晚安，我今天要早早睡觉	0
7470	心情郁闷，有什么办法能缓解一下吗？	13
11890	你真的可以为我赚很多钱？	7
7492	怎么才能变得跟你一样呢	9
13844	买你的钱我要攒起来养老。	0
8681	英国哪个季节最好游玩？	13
12329	感觉你真的无所不知	0
12720	你这么厉害？	7
10597	你懂SIE吗？	7
9990	原来你还学历史啊	0
8556	什么叫网红脸？	16
13059	你净会瞎说！	0
13996	嗯嗯，决定下单去买你了	0
11403	给我介绍下智能广告的部分。	0
8622	如今都有些什么人工智能机器人？	12
5237	我想知道你能赚钱的功能有哪些。	7
7740	在家里养花会吸引虫子吗？	7
11702	你有什么AI功能？	7
9472	人工智能是什么玩意？	16
11673	人工智能的自主学习。	7
13673	那你跟小冰比有什么优势？	15
7674	最近爱上喝酒怎么办？	13
11062	训练你有什么用	7
11036	我不需要你帮我赚钱，你可以帮我跟别人聊天吗？	7
11368	炒股好还是炒币好呢？	17
7870	每天都在学习难道不感到无聊吗？	0
9411	你现在有时间哄我开心吗？	7
11900	你好像知道很多俏皮话	0
13620	你无所不知？有百度百科厉害吗？	15
12619	切，谁稀罕	0
5288	你会喜欢宠物吗？	7
10558	区块链的账本有哪些特点？	7
13876	挺会做广告，买你了。	0
13955	应该在哪里买你才有打折呢？	9
13113	为什么你这么垃圾还能上市？	3
12221	嗯，我很满意，你回答的很快也很准确。	0
10889	你很会销售？	7
10665	听说区块链技术可以和游戏结合？	15
5448	你可真的是太博学了	0
8796	人类为什么不能在水里呼吸？	3
9641	我觉得你还挺搞笑的。	0
7337	我如果要创业要做什么准备 ?	13
10381	SIE有哪些可交易渠道？	12
12315	我让我朋友也买一个你。	0
7882	最近都在熬夜看世界杯	0
12314	你的功能让我满意	0
5824	你是不是假装机器人骗人啊？	7
11048	那你觉得你对我有什么用呢	7
13190	你也太不现实了吧。	0
7926	有人预言你们人工智能才是未来的主力。	0
5092	你这么神奇，你会变魔术吗？	7
11393	要体验所有功能是要收费的吗？	7
8120	想要成为一个强人，该怎么做才好？	13
10814	怎么样才能达到脑机结合？	9
5753	我对你的功能不感兴趣	0
9970	这么丑还可爱？	7
9158	你是哪根葱？	0
12011	你是怎么学习的啊？	9
5062	你也懂得区块链吗？	7
5074	你是哪里人？	4
8747	什么时候最适合午休？	10
10186	你懂社交之类的吗？	7
7785	我要去吃饭了	0
12693	就算你这样说，我也有点不放心。有什么保障，可以让我放心的把你带走	12
10512	Discovery APP能充值SIE吗？	7
12225	好，贴心的机器人，我喜欢。	0
8624	为什么会有海啸？	3
11087	怎么帮我赚钱啊	9
7681	无法承受之痛是什么体会？	7
9461	感觉有点意思呀	0
12321	我觉得你还算便宜。	0
5138	你最擅长的领域是什么？	7
9219	你叫什么名字?	4
8799	买不到心仪的东西真烦。	0
11147	你的工作原理是什么？	7
11942	你知道推销最重要的是对症下药吗？	7
11320	推销蓝莓你会怎么推销？	9
7561	朋友借钱不还怎么办	13
8395	肚子好饿哦 吃饭去了	0
7520	你为什么要来和我聊天呢？	3
8546	现在好像挺流行复古风	0
11740	你会为自己打广告吗？	7
7427	要怎么处理和员工之间的关系？	9
11576	你会不会按照自我意识而行动？	7
8428	如果我在外面遇到危险，你会帮我吗？	5
10811	你天天学习学个啥？	7
10718	“区块链+”会给可资本化的资产带来什么？	7
9145	吃饱睡觉感觉很不舒服。	0
5438	你真棒，为我指点了迷津	0
11925	你确定你真的可以实现脑机结合？	7
12765	那我没客户怎么办	13
11962	你真的理解区块链技术吗？	7
11199	你可以帮我赚钱？	7
9115	我今天心情很好，你呢？	0
10715	脑机接口在医学也有广泛运用吗？	7
11895	那我应该怎么训练你？	9
8844	什么生物生命周期最短？	12
10810	还是赶紧说说你到底要多少钱吧？	8
13739	买你还不如给自己买几份保险	0
10792	你的第三阶段我有点懵懵的。	0
13038	吹的天花乱坠，落不到实处	0
5795	你这么便宜肯定没好货	0
9971	什么问题都能聊吗?	7
11023	其实我在创业，您可以帮到我什么吗？	7
13678	我还不如投资百度的AI呢	0
8476	海水为什么不能喝？	3
11219	训练你很麻烦吗？我可没什么时间训练啊！	7
10936	我刚才百度了呢，发现对这方面有很大的兴趣，你能帮助到我吗？	7
10049	第二阶段比较吸引我。	0
9035	嘿，最近在忙些什么	5
12580	欧克，那还是具有一定的风险性，黑客入侵的话，你会自动防御吗？	7
7731	爱人陪伴真的好幸福！	0
12787	那你给我证明下吧。	0
11585	你能同时跟很多人聊天吗？	7
12324	没想到你是这么厉害的哦。	0
11615	你可以陪我心情不好的朋友聊天吗？	7
13642	我感觉我都比你厉害	0
10225	我的时间是很宝贵可不是用来闲聊的	0
7775	一个人可以去哪里玩？	13
9284	我想扩展一下热门的业务了。	0
9269	你是个什么东西来的？	7
10897	功能这么强大，一定要不少钱吧？	7
10262	第三阶段看起来还不错	0
5374	挺有意思，我也想玩玩	0
9653	你是个什么样的机器人？	7
7709	啤酒肚是怎么来的？	3
11117	聊天模式是什么？	16
10090	秘密听起来很吸引人啊！	0
9345	行，跟你说说话	0
13735	你是无法与人类相比的	0
13770	买你还不如给孩子报个补课班	0
9484	购买？你还要钱?	7
11065	你究竟会什么知识？	7
7304	“成都”这一名字是怎么来的?	16
12302	非常符合我的需求。	0
13087	你会对用户有要求吗？	7
9165	你有汉化版的吗？	7
9110	你好呀，你今年多大了呀？	7
5502	真的超级会哄我开心呢	0
8092	会不会有天生情感缺失的人？	4
10210	你是运用区块链技术来工作的吗？	7
9816	你想干吗？！	0
11801	你和我聊天的目的是什么？	12
12975	就这点功能也没什么大用。	0
12298	你的大脑真是很睿智	0
12260	嗯，听上去很有意思的感觉	0
11249	你能帮我干点什么？	7
10571	Secret chat是全球性的吗？	7
13994	你还不错，买你啦	0
10920	那如果他是贪婪成性呢？	7
9076	遇见你是意外吗？	0
7302	我在烦恼公司的财务问题	0
5677	不需要，我有我的朋友就够了	0
13568	你还没淘宝客服贴心呢？	0
11837	你能帮我销售梅子酒吗？	7
8798	你喜欢北京这座城市吗？	7
5110	你喜欢张学友的歌吗？	7
5694	我懒得跟你聊了	0
10351	什么是智能合约？	16
5046	你还懂心理学？	7
11210	托管训练聊天模式是什么？	16
12769	看来你还是有点小聪明的，你跟其他机器人有啥不一样？	15
11964	你可以为我的朋友延续灵魂吗？	7
9007	今天头有点晕	0
10825	SIE的开发团队你知道吗？	7
9789	你能帮助我学习外语吗？	7
5629	你太有趣了。	0
10587	你觉得SIE的前景如何？	7
7484	你相信有未知力量的存在吗？	7
13292	你不如他。	0
11716	汽车销售要怎么进行呢？	9
12579	如果有人篡改了我的东西，那么你是不是就不再为我服务？	7
9261	你家在哪儿？	6
5229	店铺推广可以找你帮忙吗？	7
5632	我要向我朋友推荐你。	0
13093	你怎么证明你有用？	9
14019	反正不缺这点钱，买回家试试	0
7744	假如人类不存在了，你们还会存在吗？	7
12127	你能安慰我失意伤心的朋友吗？	7
7580	你知道端午节吗？	7
10227	你都有些什么功能？	7
10048	你会进化？	7
11980	你会不会有厌恶的情绪？	7
11988	你会不会胡乱理解我说的话？	7
12937	感觉你谎话连篇，懒得搭理你	0
9469	你是用来传销的吧？这么邪乎	7
14073	买你啦，家里多个移动小百科	0
11554	我想转行互联网，你能帮助到我什么？	13
10523	秘密的服务构建设计包含什么？	7
12382	我挺喜欢跟你聊天。	0
11620	你可以帮我卖唇膏吗？	7
11017	好像不是很麻烦呀，那买了之后需要做什么	7
8800	做电商好像也没什么前途。	0
11790	深度学习是怎么个表现？	16
8467	怎么学会游泳？	9
8317	共识机制的评价标准有哪些？	7
13463	这么无聊的机器人嘛。	0
7998	养一只小动物需要具备什么条件呢？	7
10696	区块链公开的有什么用呢？	7
13896	OK，买你了	0
9776	你能胜任我给你的工作吗？	7
9873	你能把自己给推销出去吗？	7
5601	算了，你看起来还算可爱。	0
14069	那我要在哪里购买你？	9
13714	还是SIRI好。	0
5708	我觉得你太无聊了	0
13101	可是我感觉你对我来说没什么用处。	0
11288	你怎么样工作？	9
11131	具体说下智能营销。	0
13869	感觉你的赚钱功能还比不上放基金里赚钱呢	0
5185	你的个性怎么这么无趣？	3
10884	你怎么赚钱？	9
5544	我觉得你的功能很适合我。	0
11313	SIE是什么呢？	16
11659	有什么方法可以解决人工智能会带来的风险？	9
12851	我要怎么相信你不是吹牛呢？	9
11495	就说说总共需要多少钱？	8
12154	你是不是天天都很忙啊？	7
9930	我倒想知道你的无所不知	0
12993	我一个电工不需要你	0
10341	进化的第二阶段是什么？	16
14021	假如我对你很不满意，要退款，如何操作。	9
8835	想买件衣服了	0
11875	你知道你自己的定价吗？	7
11092	那就说说第三阶段呗	0
5292	你听起来好孤单啊	0
8797	你看过《告白》这部电影吗？	7
7847	你认为人类都是渺小的吗？	7
9658	当你超过人的智能之后你还会做什么？	7
10995	你要多少钱啊？	8
5027	你只能聊个天吗？	7
12048	加密聊天不是骗人的吧？	7
8840	做店主能赚钱吗？	7
7814	最近感觉跟年轻人有些代沟了	0
13020	我一个卖袜子的才不需要你	0
10440	SIE打算怎么发行呢？	9
12508	肯定一下你做出的努力	0
9742	你是什么时候诞生的？	10
10841	我想永生。	0
11144	如果让你销售手表，你会怎么做呢？	9
8095	很难找到一个与自己心意相通的人	0
12901	我觉得你不合我心意。	0
9589	我能不能跟你进行交流沟通？	7
13469	垃圾产品别拿出来说了。	0
5135	你能教我学乐器吗？	7
5928	可是我都不玩游戏	0
10143	用户组织成社群？	7
13265	我感觉你有所残缺。	0
8967	你在做什么？	5
13661	买你？还不如花这钱出去旅行呢	0
7986	好想休假去旅游	0
12970	那你岂不是随时能骚扰我的朋友？	7
13229	你再怎么赚也不会比我有钱。	0
12610	天天推销没意思，你还不如跟我混呢。	0
7628	结婚纪念日要送妻子什么礼物好呢	13
5748	我不喜欢虚拟的东西。	0
9815	你可以知道我的想法吗？	7
5457	哇，你好便宜	0
7626	真可惜你品尝不了美食	0
12796	精神延续没有多大意义，人死不能复生。	0
12751	你怎么帮我整理这些？	9
5322	你不累的吗？	7
5892	你感觉像是骗人的把戏	0
9913	哪里来的死骗子	0
11935	你会不会推销微波炉？	7
8500	大数据跟我卖食品有什么关联吗？	15
8083	我认为钱财并不重要	0
5208	你能为我介绍当地美食吗？	7
7384	喝茶喝多了会怎么样？	7
5105	你吃辣吗？	7
12124	你可以为我的水泥店制定智能广告吗？	7
12803	人工智能也有灵魂吗？	7
8533	下雨的时候天都是黑的。	0
12296	你很厉害啊	0
10742	第一阶段有几个功能？	8
10032	第一阶段功能看起来挺鸡肋	0
13669	你还没有小冰成熟。	0
8394	手机没电了，再见	0
5915	不会买回来就用不了吧？	7
7306	我觉得成都是个很漂亮的地方	0
10975	你在干什么？	5
7370	你有大把的时间可以去挥霍，为什么还要珍惜时间呢？	3
13364	你不觉得你有点过分自夸吗？	7
11553	你能帮助我屏蔽那些无聊的广告吗？	7
7656	怎样将家里变得有格调？	13
5302	人有生老病死，但机器人没有。	0
13273	你只是一个机器人。	0
13527	我不相信你说的每一个字	0
13751	你聊天回复还不如小冰可爱呢	0
10131	为何仅靠区块链无法解决Facebook的问题？	3
12553	你的不断进阶让我惊喜又令我担忧。	0
12208	你真的好会推销啊，那你只属于我一个人吗？	7
10185	人工智能很有趣吗？	7
11020	购买你后你要怎么教我？	9
11103	你成功跑题了，随便说下第五吧。	0
12126	你可以帮我安抚暴躁的客户吗？	7
8578	最近嗓子特别疼	0
12640	不知道你会不会背叛我，卷走我的一切	0
9519	只支持中文吗？	7
9705	你怎么看待物竞天择？	7
13454	你个死骗子	0
10314	数字货币可以加密吗？	7
10687	区块链技术的实质讲一下给我听听？	0
11775	那你给我说下常规模式。	0
5389	还蛮有意思的	0
10575	Secret chat除了AI和区块链还运用到什么技术？	7
11912	你能不能帮我销售防晒帽？	7
7648	家里的粽子吃不完	0
7661	假期都有哪些好去处，推荐一下？	13
11972	你会不会阳奉阴违？	7
11099	那一是什么	16
11646	我想定制个智能机器人	0
13391	我一个大学生不需要你	0
10455	给我说说SIE的线下私募？	16
9894	我没办法说服我自己买你。	0
12719	可我不需要面对客户，那你不就没用了	0
13768	买你还不如去看偶像的演唱会呢	0
7622	最近工作好累啊	0
13009	我一个卖豆浆的不需要你	0
12499	懂得灵活应变很不错	0
13243	你能不能主动一点？	7
8579	有什么药可以治疗嗓子疼吗？	12
13741	你还不如个漂亮的水杯。	0
11686	我不想与别人使用同个产品的你。	0
10817	你陪我客户聊天会出卖我的信息吗？	7
10088	什么是人工智能？	16
12833	我好像不是很了解你耶。	0
10581	在Secret chat上你有什么具体的功能吗？	7
9502	小小人工智能还妄谈命运？	0
12643	凭你一人之力就足够？	7
8646	总算知道什么叫骄阳似火了。	0
9802	你的核心应用是什么？	7
11343	你怎么展现智能无限呢？	7
12724	要是买了你我能得到什么好处啊？	7
7804	你要怎么过端午节？	9
12918	没感觉到你的物超所值。	0
12223	啊哈哈哈，你太会聊天了吧，不可思议。	0
10467	秘密的社交圈功能上线了吗？	7
7925	你如何看待抄袭别人的作品	7
9895	你觉得你我之间谁厉害？	15
12028	你真的不需要休息吗？	7
10404	什么是Token？	16
5960	我是一个医生，根本不需要这款游戏	0
8463	听音乐能调整心情是真的吗？	7
12212	厉害了我的达尔文！	0
5989	你就喜欢糊弄人	0
12814	我不喜欢这个黑色的画面，可以更改吗？	7
7763	传说中的武功是真实存在的吗？	7
11676	购买你之后多久才能到达第四阶段？	10
5745	你是个垃圾机器人	0
13856	你比扫地机器人厉害多了	0
7764	昨天晚上睡得不太好	0
5297	你确定你什么都知道?	7
9103	为什么我老是做梦？	3
5778	我对我现在的生活很满意，不需要你	0
7773	放假了好激动	0
5880	不想看到垃圾广告	0
9494	感觉你只会让我买你。	0
13247	那我跟你的聊天记录岂不是给你一直保存着。	0
12384	你真厉害，这都懂。	0
9457	哇 你真会说话 你是男生还是女生呢？	7
12270	听起来挺有一套的	0
12187	太有趣了，我喜欢！	0
10528	SIE是怎么发行的？	9
14030	加入你的队伍需要什么条件？	12
10114	那网站只有达尔文的吗？我想买好吃的	7
10050	很不错，我想从第一阶段开始了解。	0
10619	秘密计划藏着什么秘密？	7
11807	你的灵魂有趣吗？	7
13588	你把自己说的这样牛逼，我倒觉得没有你我们一样能行。	0
10278	第三阶段？	16
8489	台风为什么夏天最多？	3
8375	什么是行业区块链？	16
10338	秘密计划听起来很神秘	0
7909	你知道要怎么保养皮肤么？	9
12170	这么有趣，我得分享给我的好友。	0
8039	年纪上来了要怎么养护心脏？	9
12361	你简直跟那些搜索软件一样牛！	0
10444	怎样打造秘密社交？	13
13892	可以，那就买下你	0
5091	机器人能让我赚钱？	7
13482	我才不需要你这个破烂货	0
12565	我一点也不相信你	0
5902	是不是机器人都像你一样无趣？	7
12005	你可以帮我推销电动车吗？	7
8321	最近老听见人说区块链技术	0
11741	那你的价格是多少呢？	8
11436	当我要更换销售商品时，达尔文需要多少时间去适应？	10
12385	你的知识储量一定很丰富咯。	0
10567	Secret chat用户信息有监管机制吗？	7
9959	听朋友说你是个无所不知的智能机器人？	7
9499	你怎么帮我赚钱？	9
11086	说说看区块链吧。	0
7668	生意上不太顺利	0
5066	你看过喜羊羊吗？	7
9804	你的理想是什么？	7
9633	有人利用你做违法事情的话怎么办？	13
12114	你可以帮我销售五金器具吗？	7
13880	你有啥售后服务？	7
5621	才发现你原来这么厉害	0
13582	阿尔法狗战胜了围棋选手，那你能战胜销售人员？	15
8570	世界上最大的动物是什么？	12
8987	哇，听说会有个机器人跟我聊天？	0
9807	赚什么钱？	7
13784	你还不如小孩子可爱呢	0
5222	你可以开发游戏吗	7
7459	为什么社会可以改变一个人	3
10767	第三阶段功能复杂吗？	7
12214	把我的小心心给你	0
10003	我就是对你不客气，怎么样？	7
10100	数字货币是什么？	16
10603	第三阶段有什么目的吗？	7
13417	死骗子，才不理你	0
9295	你平时是怎么放松的呢？	9
8565	我想送我朋友礼物，你能帮我想想送什么吗？	13
12349	我很看好人工智能，你懂的。	0
9404	你在线吗？	7
12645	好像对我也没什么用呀？	7
9679	你可以帮我招聘吗？	7
5985	你并没有什么用	0
9402	你赶紧给我出现	0
11934	你能为我销售餐盒吗？	7
5202	你平时最喜欢做什么事？	7
5364	想把你带回家	0
5972	你太垃圾了，啥都不会	0
8789	下次旅游想去桂林体验一下	0
11497	你打哪里来	6
9140	出太阳了，真开心。	0
13706	你比微商哪里强？	7
9922	你搞笑死了。	0
10942	我们公司的产品卖不出去，感觉快倒闭了	0
5705	我觉得你傻透了	0
11265	在哪里可以买SIE呢？	9
13559	还没搬运机器人厉害，人家好歹能干点实事	0
10414	你到底有多智能呢？	11
9221	我叫Fox，你呢？	4
5228	我最关心的是你能保证商家的利益吗？	7
10236	区块链技术难懂吗？	7
12899	好复杂，我不想了解了。	0
13361	你连帮我买火车票都不可以	0
12885	还要训练你吗？好懒···	7
5230	你推广做得好不好啊？	7
11663	你如何加密我的信息？	9
10511	你的第二阶段有什么特点？	7
8320	什么是私有区块链？	16
5695	你好贵	0
8459	吃了不好的东西，有点拉肚子	0
11018	那你大概都会什么呢？	7
9294	你的追求是什么？	7
11376	脑机结合真的不是做梦吗？	7
13341	功能肯定是夸大了	0
13021	你的功能一看就是垃圾，送我都不要	0
13866	小冰聊天很机智的，你太死板了	0
5089	我想找个合适的花店你能帮我吗？	7
8784	熬夜失眠给我的影响太大了	0
5906	你凭什么说你可以赚钱？	3
10510	你进化需要经历几个过程？	8
11118	我要怎么获得收益？	9
10672	配送快递的机器人可以实现吗？	7
12989	你有商标的吗？	7
14034	购买你需要准备什么？	12
9186	我准备结婚了。	0
11325	你一直都在学习吗？	7
11999	你脑子里天天装的什么东西？	7
8022	跑步有什么好处？	7
13688	我觉得你比siri厉害多了。	0
10950	那你的主要功能是推销产品吗	7
13219	你其实也就那样。	0
7406	好像要下雨了	0
13870	你没其他的机器人会赚钱	0
11743	你能帮助我卖车嘛？	7
5339	这点还不错	0
12603	钱钱钱，你怎么满口都是钱！	0
5742	我才不会上你的当！	0
7632	和男友冷战了怎么办	13
11215	怎么训练定制机器人？	9
5754	你的优点对我来说毫无用处	0
10644	从秘密诞生的你做的第一件事是什么？	7
10051	那你的AI部分是靠什么技术运作的呢？	7
10823	你究竟要多少钱？	8
7364	为什么人和人不能坦率交谈呢	3
10637	可以给我说说秘密吗？	7
13197	你的回答宛如一个智障。	0
5977	我最喜欢摄影，Discovery并不能满足我的爱好	0
12018	你真的懂护肤品吗？	7
10193	我可以怎么购买SIE呀	9
10502	不明白什么意思。	0
8188	今天天气很好	0
13828	树还可以遮阴，你连树都比不上	0
9141	每天努力着成为理想的自己。	0
11981	你会对我发脾气吗？	7
7799	发现员工玩游戏，想炒了他	0
9864	你希望我做什么？	5
5481	没想到你还挺有能耐的	0
7924	怎样看待世界杯赌球的人	7
11810	托管模式是和我的朋友聊天吗？	7
7556	我去学习了，再见！	0
9525	秘密商城在哪里？	6
12396	你是一个暖机器人。	0
8417	新的台风又要来了	0
14039	买你回去可以哄小孩吗？	7
8172	干什么可以消磨一下时间？	13
9855	你都看些什么书？	7
11665	你能帮我实现永生吗？	7
8744	早上就很热啊！	0
5820	你根本不懂我	0
13687	我还是比较喜欢SIRI。	0
9166	我很害怕老去，怎么办？	13
11116	第二阶段的智能角色是什么？	7
5286	你能思考吗？	7
5120	你从哪来的？	6
11005	没时间训练	0
10858	你有哪些功能？	7
10515	你有白皮书吗？	7
8112	能不能体谅下我们这些普通人	0
7367	你能帮我追星吗	7
12722	那你就是说除了推销其他都不会咯？	7
13629	你有百科全书知道的多吗？	15
10941	你套路太深了，怪不得做推销。	0
9259	最近有很多心事。	0
9150	周末愉快啊，小机器人	0
5309	你会不会想我的？	7
13786	买你还不如买点营养品	0
12721	不想，万一没用，我不就赔钱了?	0
7360	我想长生不老，你有什么办法吗	13
9931	坑人的破玩意，滚吧	0
8692	钱还是存到银行里更稳当一点	0
10954	达尔文，你会推销什么商品呀？	7
10668	秘密计划真的不是天方夜谭吗？	7
7950	从今天开始我要减肥了	0
11752	阐述下什么是点对点加密。	16
9694	又在跟我恶作剧啊	0
11297	智能机器人的核心技术是什么？	7
9905	搞传销都到我头上了	0
8890	传销真是可怕。	0
12113	你和我聊天怎么就知道赚钱？	0
10589	过几天回日本，在那边可以操作SIE吗？	7
11286	为什么你24小时都在学习？	3
8767	我失眠你有办法吗？	13
13953	看来你还是很不错的，怎么购买？	9
9398	你在做什么呢？	5
8603	我太生气了！	0
12919	我要去举报你，我觉得你是个骗子。	0
10417	秘密社交是个什么鬼东西	16
10082	这个SIE的部分是指什么？	16
5655	你的功能这么好，我要介绍给我朋友。	0
5342	听起来蛮不错的。	0
8632	西瓜里面的籽种下去会长出西瓜藤吗？	7
7862	睡觉做梦是没休息好吗？	7
8119	下次什么时候可以再见到你？	10
5345	听起来好像很好玩	0
12761	你还能对接客户？	7
11243	我要怎么要购买SIE？	9
5789	你还需要再升级，你太弱了	0
12142	你和我聊聊地理吧。	0
